date,page,tag,title,url,content
2021年4月16日,7,评论,雄安新区，迎着春光拔节生长（现场评论・为“十四五”开好局起好步①）,http://paper.people.com.cn/rmrb/html/2021-04/16/nw.D110000renmrb_20210416_1-07.htm,开局关系全局，起步决定后势。今年是“十四五”开局之年，也是我们党成立100周年。确保实现“十四五”良好开局，以优异成绩迎接建党100周年，就要迈出新步伐、展现新作为、凝聚精气神。本版今起推出系列评论，聚焦各地区各部门各领域创新发展的实绩，为昂首迈步新征程凝心聚力。　　――编?者?　　　　以新发展理念为引领，尊重规律、把握节奏、接茬实干，雄安新区的建设定能经得起历史检验　　这片建设发展的热土，不仅规划得清清楚楚，植根于此的事业也在迎着春光拔节生长　　　纵横凌云笔，燕赵涌春潮。从“一纸规划”绘蓝图，到“多点开花”抓实干，坚持“世界眼光、国际标准、中国特色、高点定位”理念的雄安新区，正向着“未来之城”进发。　　习近平总书记指出：“建设雄安新区是千年大计。新区首先就要新在规划、建设的理念上，要体现出前瞻性、引领性。要全面贯彻新发展理念，坚持高质量发展要求，努力创造新时代高质量发展的标杆。”“十四五”开局之年，走在新区大地上，以前“塔吊林立”变成了如今“塔楼并立”，繁忙的建设场景见证着日新月异的变化。　　雄安新区，每一天都是新的。白洋淀碧波荡漾，千年秀林绿意正浓，京雄高速即将贯通，综合管廊主体完成……眼下，雄安新区规划面积1770平方公里的土地上，每天有16万多名建设者挥汗如雨，200多项重点工程项目不断推进，大规模建设不舍昼夜。在充满生机的春天里，雄安新区用一笔一画的书写，为世人铺展开一幅美丽画卷。　　建设雄安，体现高质量发展要求。规划建设新区，有着更高起点、更高层次、更高目标。要建设绿色生态宜居新城区、创新驱动发展引领区、协调发展示范区、开放发展先行区，努力打造贯彻落实新发展理念的创新发展示范区。在新区，城市计算中心、物联网等加快构建，智慧道路、智能管廊等新基建开工建设，新区主城区、雄安高铁站等重点场所实现5G信号全覆盖，一座充满智慧的城市蓄势待发。项目中体现质量，细节处彰显标准，以新发展理念为引领，尊重规律、把握节奏、接茬实干，雄安新区的建设定能经得起历史检验。　　聆听雄安，感受敞开怀抱的态度。在河北雄安智绘未来科技孵化园内，一家来自北京的创业公司，即将入驻100多平方米的办公区。园区内，类似的科创企业和服贸企业已有45家，预计今年将达到80家1500多人的规模，这些创业者大都是年轻人。全新技术面对无限机遇，雄安新区吸纳八方英才。一位“拎着拉杆箱到雄安”的创业者，展望公司未来前景，踌躇满志地说：“年轻人如果想打拼出一番事业，来雄安是个好选择！”这片建设发展的热土，是年轻人干事创业、奋斗逐梦的热土，不仅规划得清清楚楚，植根于此的事业也在迎着春光拔节生长。　　展望雄安，激发奋进向前的活力。发展活力催生前行动力，这需要向机制改革要活力、向体制创新要动力。在雄安新区政务服务中心办事大厅，工作人员专心盯着办公电脑。申请人线上轻点鼠标，审批“秒批即办”。随着行政审批改革按下“快进键”，新区正在努力实现“一窗受理、一网通办、一次办结、一枚印章管到底”。改变工作作风、优化营商环境、提供优质服务、提高办事效率，最终增强的是制度活力。以一流的作风、一流的环境，加快形成新形象、建设新功能、发展新产业、聚集新人才、构建新机制，就能不断提升“雄安服务”知名度，凝聚团结奋进精气神。　　起笔，即是世界眼光；落笔，便为时代标杆。“十四五”开局之年，是雄安新区大规模开发建设的关键一年。始终挺立时代潮头、保持历史耐心，谋划长远、干在当下、稳扎稳打，雄安新区一定能创造出新时代的光辉业绩。　　（作者为本报河北分社记者）
2021年4月16日,7,评论,铺就更加坚实的幸福之路（评论员观察）,http://paper.people.com.cn/rmrb/html/2021-04/16/nw.D110000renmrb_20210416_2-07.htm,在新疆的发展上，党和国家坚持谋长远之策，行固本之举，建久安之势，成长治之业，让今日之新疆处处春潮涌动、生机勃发，创造出一个个发展奇迹　　　　不久前，两位新疆姑娘发布了一份报告，引发众多关注。这份历时9个月调研、走访多家广东企业、接触474名在粤新疆少数民族务工人员并与70位深入对话而形成的报告，以丰富翔实的第一手素材，细致全面地展现了新疆少数民族务工人员的日常工作和生活。他们通过外出务工增加收入、开阔眼界，铺展开了美好生活的新画卷。　　“我们新疆好地方，天山南北好风光。”位于祖国西北角的大美新疆，是无数人心向往之的旅游胜地，更是2500万各族儿女安居乐业的幸福家园。我们党历来高度重视新疆工作，习近平总书记指出：“我们党的初心使命就是为包括新疆各族人民在内的中国人民谋幸福，为包括新疆各民族在内的中华民族谋复兴。”近些年来，在新疆的发展上，党和国家坚持谋长远之策，行固本之举，建久安之势，成长治之业，让今日之新疆处处春潮涌动、生机勃发，创造出一个个发展奇迹。　　巍巍天山、壮美昆仑，见证着新疆的历史巨变：总人口稳步增长，其中维吾尔族人口从1978年的550多万增长到如今的1200多万；60多年来，人均寿命从30岁提高到72岁；经济发展持续向好，2014年至2019年地区生产总值年均增长7.2%，所有地州市迈入高速公路时代；人民生活明显改善，居民人均可支配收入连年增长，贫困人口实现全部脱贫，医疗、就业、教育等为重点的惠民工程持续推进，各族群众的获得感、幸福感、安全感显著增强。如今，新疆各族人民享有稳定、安全、发展、进步，这是最成功的人权故事之一。　　新疆喀什疏勒县红星村的如则・阿皮孜的经历，是新疆发展的一个生动缩影。几年前，他患有严重的腰椎间盘突出，根本无法打理农活。后来通过申请贫困户手术治疗项目，他到乌鲁木齐接受了免费手术。如今恢复健康的如则，摘掉了贫困的帽子，“生活一天比一天好”。近年来，从实施健康扶贫工程，为大病、慢病、重病贫困人口兜底保障，到启动全民健康体检工程，确保城乡居民每年可享受一次免费健康体检，一系列扎扎实实的医疗惠民举措，有力保障了各族群众的健康权、生命权，让各族群众共享“健康红利”。　　就业是民生之本，劳动创造美好生活。党的十八大以来，新疆大力实施就业惠民工程，持续加大就业培训力度，积极拓宽就业渠道，基本实现了“家家有门路、人人有事干、月月有收入”。如今，许多人通过自主选择，找到了合适的工作。无论是农村还是城市，无论是田间地头还是生产车间，他们不仅学到了技能，提高了收入，更增长了知识才干，实现了人生价值。就业惠民让各族群众“钱袋子”越来越鼓，也让他们用双手创造美好生活的信心越来越足。　　“最好的建筑是学校，最美丽的风景在校园”，这是今日新疆的真实写照。教育是阻断贫困代际传递的治本之策，也是少数民族迈向现代化的重要桥梁。全疆实现九年义务教育全覆盖，南疆实现15年免费教育全覆盖，农村幼儿园适龄儿童“应入尽入”，贫困家庭义务教育阶段孩子因贫失学辍学实现动态清零，兴办寄宿制学校有效解决偏远农牧区孩子上学问题，高等教育走向内涵式发展……从“有学上”到“上好学”，新疆教育事业正向更加公平而高质量迈进。　　如今，在新疆阿拉山口、霍尔果斯口岸，一列列中欧班列如同“钢铁驼队”，延续着古丝绸之路的传奇，也为新疆带来全新的发展机遇。乘着新时代的浩荡东风，新疆必将开拓更加广阔的发展之路，为各族群众铺就更加坚实的幸福之路。
2021年4月16日,7,评论,在线诉讼提升司法效率（新论）,http://paper.people.com.cn/rmrb/html/2021-04/16/nw.D110000renmrb_20210416_3-07.htm,在线诉讼这一互联网司法新模式，给人民群众带来切实便利，成为深化司法体制改革的一个着力点　　　　“当事人足不出户就能参加诉讼”“在线庭审平均用时36分钟，比线下节约2/3，案件平均审理周期60天，比线下缩短1/4。”今年的最高人民法院工作报告提出，保障在线诉讼依法规范进行。在线诉讼这一互联网司法新模式，给人民群众带来切实便利，成为深化司法体制改革的一个着力点。　　习近平总书记指出：“没有信息化就没有现代化”。审判体系和审判能力的现代化，同样离不开信息化。作为人民法院信息化建设的重要成果，无接触式的在线诉讼成功通过了新冠肺炎疫情的“大考”，也在疫情期间实现了加速落地。只要一部智能手机、一台电脑，就能完成立案、送达、调解、开庭、执行等诉讼程序。这极大方便了诉讼当事人，减轻了因时空局限所产生的诉讼负担，实现了“审判执行不停摆、公平正义不止步”。同时，诉讼全过程的信息化、无纸化，也为完善司法公开、提升司法效率、落实司法问责提供了充分的技术条件。　　符合司法规律的信息化建设，助力在线诉讼全面升级。近年来，人民法院在完成以数据为核心的信息化3.0版之后，为落实“十四五”规划和2035年远景目标纲要的要求，提出了以知识为中心的信息化4.0版的目标。未来升级后的在线诉讼，有望实现5G远程庭审、VR还原现场、人脸情绪识别等，区块链技术的深化应用也有望解决电子证据的鉴真难题。基于司法大数据整合的智能审判辅助，可以为更加客观认定事实、更加精准适用法律提供助益。　　建设网络强国，在线诉讼是与之匹配的审判运行模式。同时也应看到，当前在线诉讼还存在一些不足。比如，“隔空”庭审缺乏现场参与，一定程度影响司法的严肃性与仪式感；“云端”质证也会涉及线下证据的审核、判断等问题。推动在线诉讼更有质量、更加高效，需要完善与信息化技术相适应的程序规则。不久前，最高人民法院就在线办理案件的规定向社会公开征求意见。线上与线下的诉讼场景虽有不同，但都应当进行规则治理。通过更为详细、合理的在线诉讼程序规则，使法官有法可依，当事人有规可循，更有利于守护“云端”秩序。同时，除了明确适用范围与条件，指引法官选择适合的案件进行在线诉讼之外，还应当充分尊重当事人的选择权。　　在线诉讼满足了人民群众的现实需求，也彰显了人民法院坚持以人民为中心、牢记司法为民宗旨。随着信息技术与司法规律的加速融合，更高效、更便捷、更有质量的在线诉讼，将更好守护社会公平正义，也将为全球互联网法治发展积极贡献中国方案。　　（作者单位：清华大学法学院）
2021年4月16日,7,评论,图片报道,http://paper.people.com.cn/rmrb/html/2021-04/16/nw.D110000renmrb_20210416_4-07.htm,随着我国机动车保有量不断增长，一些城市的交通治理面临违规行为多、交警警力不足等情况。河北省保定市探索运用高科技手段，构建起集“智慧车管”“智慧指挥”“智慧监管”于一体的智慧交管平台，方便群众办事，及时处理警情，提升了交通治理的精细化、法治化水平。　　这正是：　　省去来回奔忙，　　掌握路网情况。　　智慧交管助力，　　道路更加通畅。　　曹希阳图??杨??羽文
2021年4月16日,7,评论,铁路发展为民生幸福加码,http://paper.people.com.cn/rmrb/html/2021-04/16/nw.D110000renmrb_20210416_5-07.htm,全国铁路营业里程达14.63万公里，高速铁路运营里程达3.79万公里，“四纵四横”高铁网提前建成，“八纵八横”高铁网加密成型……习近平总书记指出：“一个流动的中国，充满了繁荣发展的活力。”越来越密的铁路网络，越来越快的运行速度，勾勒出一个充满发展速度与民生温度的中国，也见证着中国铁路服务国民经济的不懈奋斗。　　打通“大动脉”，见证发展速度。郑渝、郑阜高铁开通，中部“两小时经济圈”从蓝图变为现实；广深港高铁使粤港澳大湾区的交通动脉越来越通畅；100万人口及以上城市中，95%以上有高铁连通……四通八达的铁路，不仅大大缩短了城市之间的时空距离，也极大带动了沿线的物流货运，为当地旅游业、服务业等的发展注入强劲动能。　　畅通“微循环”，体现民生温度。昌赣高铁开通后，沿线旅游业迎来新机遇；日兰高铁日曲段开通运营，沂蒙革命老区接入全国高铁网，奔小康有了“加速器”；81对公益小慢车几十年不调价，惠及600余个边远山区县的百姓……畅通“微循环”、接入“大循环”，通达的铁路连接起许多人的出行梦想，也为许多地方致富增收提供了抓手。　　推广“智能化”，致力便民利民。近年来，我国铁路系统大力开展智能化、数字化转型升级，电子客票、移动支付、网上订餐、在线选座、刷脸验核等新举措、新形式极大提升了人们的出行体验。从窗口大排长龙到网上便捷购票，从持票进站到刷脸进站，随着铁路服务举措的推陈出新，旅客们搭上了移动互联的快车，感受到“人民铁路为人民”的初心。　　“十四五”时期，我国铁路建设仍将保持较大规模。预计到2025年，全国铁路营业里程将达到17万公里左右。加快推动铁路发展质量变革、效率变革和动力变革，必能早日建成现代化铁路强国，为民生幸福不断加码。
2021年4月16日,7,评论,以担当作为谱写乡村振兴新篇章（治理者说）,http://paper.people.com.cn/rmrb/html/2021-04/16/nw.D110000renmrb_20210416_6-07.htm,做好巩固拓展脱贫攻坚成果同乡村振兴有效衔接，工作不留空档，政策不留空白，需要一件事接着一件事办、一年接着一年干　　　　山东菏泽是传统农业大市，下辖4744个村，主要以种植农作物为主。2013年，习近平总书记在山东考察期间来到菏泽，指出“一个地方的发展，关键在于找准路子、突出特色。”近年来，菏泽深入贯彻落实习近平总书记重要讲话精神，抢抓重大机遇，坚持党建引领，推动特色产业加快发展，以担当作为努力谱写乡村振兴新篇章。　　发挥基层组织头雁效应，锻造乡村振兴坚强领导保障。乡村振兴，要发挥基层党组织作用，以引才聚才育才为乡村发展提供人才支撑。菏泽以“头雁工程”为引领，注重从机关干部、退役军人、返乡创业人员中遴选村党组织书记，推荐懂农业、爱农村、爱农民的机关干部到基层任职；开展农村优秀人才“回引计划”，鼓励更多本地人参与乡村治理；强化农村基层党组织书记管理，深入开展培训，增强素质、提升能力。多方面发现人才、多渠道引进人才、多层次培育人才，才能不断为乡村振兴注入新鲜血液。　　发展壮大村级集体经济，补齐乡村振兴经济发展短板。近年来，菏泽因地制宜发展村集体经济，多路径增加农村经济收入。探索开展村党支部领办合作社，坚持“一村一策、一村一案”，拓宽发展模式、做优做强产业。菏泽将党支部的政治引领、合作社的抱团发展、群众的能动作用等要素有效融合，通过土地入股、资金入股、劳动力入股、基础设施入股等方式，组建土地股份、旅游股份、入股龙头企业等形式的合作社，实现“支部有作为、党员起作用、群众得实惠、集体增收入”的良性循环。　　整顿软弱涣散村党组织，铸强乡村振兴坚强战斗堡垒。着力选优配强村党组织书记，通过上级选派、公开遴选等方式，先后调整162名村党组织书记，优化组织队伍；实行“一村一策”，建立工作台账，定期摸排；研究制定跟踪问效机制，对已完成整顿的持续跟踪问效一年，确保整顿成效……坚持把建强农村党组织作为推动乡村振兴的关键，紧盯村党组织，持续整顿转化提升，才能把农村党组织建设成推动乡村振兴的坚强战斗堡垒。　　提升村级工作运转水平，夯实乡村振兴基层治理基础。党的基层组织领导有力、村级工作运转高效，党中央决策部署才能贯彻落实到位，群众才能真正享受到发展成果。为此，菏泽推进村党组织书记通过法定程序担任村委会主任、农村集体经济组织主要负责人，有力提升基层党组织的组织力。同时，加大村级组织运转经费投入力度，优先保障村级组织运转经费。2020年市级财政补助村级组织运转经费5000万元，比2019年增加1000万元。提升村级治理能力和水平，做到“小事不出村、大事不出镇、矛盾不上交”，以党组织的影响力不断增强基层党群凝聚力。　　习近平总书记强调，脱贫攻坚取得胜利后，要全面推进乡村振兴，这是“三农”工作重心的历史性转移。做好巩固拓展脱贫攻坚成果同乡村振兴有效衔接，工作不留空档，政策不留空白，需要一件事接着一件事办、一年接着一年干。接力奋斗、久久为功，一定能朝着共同富裕稳步前行，绘就乡村振兴壮美画卷。　　（作者为山东省菏泽市委书记）
2021年4月19日,10,评论,新冠疫苗接种是道必答题（人民时评）,http://paper.people.com.cn/rmrb/html/2021-04/19/nw.D110000renmrb_20210419_1-10.htm,我国正在按照“应接尽接、梯次推进、突出重点、保障安全”的原则，积极组织实施疫苗接种，稳步提高疫苗接种人群覆盖率　　我们必须把握窗口期，加快推进接种疫苗，这样才能有效抵御疫情输入的风险，在全球疫情防控中跑赢下半场　　　　当前，我国新冠疫苗接种工作有序展开，接种总剂次数居全球第二。从3月下旬开始，我国启动了新冠疫苗接种数据日报制度，这是我国疫苗接种史上首次启动日报制度。每天更新新冠疫苗接种数据，既是展示一张“进度表”，也是发布一道“动员令”。　　在全球新冠肺炎疫情仍在流行的背景下，我国疫情防控措施得力，国内感染风险较低，但疫情传播风险依然存在。防控疫情最有效、最经济的办法，就是接种疫苗。目前，我国新冠病毒疫苗研发取得可喜进展，已有多款疫苗获批使用。我国正在按照“应接尽接、梯次推进、突出重点、保障安全”的原则，积极组织实施疫苗接种，稳步提高疫苗接种人群覆盖率。　　值得注意的是，部分群众对疫苗接种的科学性、重要性和必要性还存在一些认识上的误区。当前，部分群众疫苗接种意愿不高，一个重要原因是国内疫情形势好转。有人存在侥幸心理，觉得随着天气变暖，疫情不会加重，没有必要再打疫苗了；有人怀疑疫苗的安全性和有效性，担心接种疫苗会发生不良反应，影响身体健康；有人认为接种疫苗的保护作用不大，打不打都一样；还有人认为“别人打了，自己就不用打了”，盲目指望靠他人建起免疫屏障。这也提醒我们，让理性战胜偏见，让科普跑赢谣言，才能打消部分群众的顾虑，让“应接尽接”尽早成为现实。　　事实上，接种疫苗是战胜疫情的利器，利己利人，利国利民，不是选择题而是必答题。于个人而言，接种疫苗，既能保护自身健康，也能保护家人和周围人的健康；于国家而言，接种疫苗，不仅可以降低感染率、重症率和病亡率，而且可以有效阻断疫情传播，让大多数人的健康得到保证。可以说，接种疫苗是一份社会责任。因为传染病是在人与人之间传播的，没有人是一座“孤岛”，没有人能够独善其身。如果人人心存侥幸，或者将阻断病毒传播的希望寄托在他人身上，免疫屏障就无法建立。同时，针对个别地方接种工作中出现的简单化甚至“一刀切”情况，强制要求全员接种，必须坚决予以纠正。　　当前，我国除个别地方外已无新冠肺炎本土新发病例，防疫形势稳中向好，这很容易使人忽视疫情防控的长期性和艰巨性。在全球疫情防控中，中国跑赢了上半场。但是，如果不尽快建立起免疫屏障，就有可能形成一个免疫洼地。在人员流动频繁的现代社会，重新打开国门是必然趋势，而目前我国绝大多数人尚处于没有免疫的状态。只有通过大规模疫苗接种实现群体免疫，才能完全打开国门，否则会面临很大风险。因此，我们必须把握窗口期，加快推进接种疫苗，这样才能有效抵御疫情输入的风险，在全球疫情防控中跑赢下半场。　　前不久，云南瑞丽再次出现新冠肺炎疫情，为人们敲响了警钟。目前，我国绝大多数人都是新冠肺炎的易感染者，如果身体条件允许，建议都去接种疫苗。从构筑免疫屏障角度看，接种疫苗，既是个人权利，也是公民义务。只有人人参与、人人尽责，才能筑起强大的免疫屏障，打赢疫情防控阻击战。
