date,page,tag,title,url,content
2021年4月9日,7,评论,保护好管理好运用好革命文物（评论员观察）,http://paper.people.com.cn/rmrb/html/2021-04/09/nw.D110000renmrb_20210409_1-07.htm,保护好、管理好、运用好革命文物，发挥好革命文物在党史学习教育、革命传统教育、爱国主义教育等方面的重要作用，必能充分激发广大干部群众的精神力量　　从革命文物中汲取养分，积蓄新征程上的信心和斗志，党团结带领14亿人为之奋斗的伟大事业也会继续乘势而上，写下新的篇章　　　　最近，北京、上海、天津等地陆续公布一批革命文物名录，种类多样、分布广泛，为开展党史学习教育提供了丰富的资源。　　习近平总书记对革命文物工作作出重要指示强调：“革命文物承载党和人民英勇奋斗的光荣历史，记载中国革命的伟大历程和感人事迹，是党和国家的宝贵财富，是弘扬革命传统和革命文化、加强社会主义精神文明建设、激发爱国热情、振奋民族精神的生动教材。”前不久，国家文物局公布，全国共有不可移动革命文物3.6万多处，国有可移动革命文物超过100万件/套。保护好、管理好、运用好革命文物，发挥好革命文物在党史学习教育、革命传统教育、爱国主义教育等方面的重要作用，必能充分激发广大干部群众的精神力量。　　保护好革命文物，就是保护好历史的见证。党的十八大以来，以习近平同志为核心的党中央高度珍视革命历史，统筹推进革命文物保护利用工作。中办国办就实施革命文物保护利用工程出台政策，财政部门对革命文物保护予以专项资金保障，相关部门对红色旅游基础设施加大投入……从制度完善到财力支持，从多部门协同到多地区协作，党委领导、政府主导、部门协作、社会参与的革命文物工作格局在发挥作用，一大批革命文物在新时代焕发出更大的生命力。　　管理好革命文物，才能实现在保护中传承。保护若要持续向好，管理就该跟上步伐。中央编办批复国家文物局设立革命文物司，就起到了很好的示范。许多省级文物部门纷纷设立革命文物处，从机构到人员、从管护意识到管护力量不断增强，进一步夯实了保护利用革命文物的基础工作。一位热心革命文物保护事业的人士说，“文物必须进行精细的整理之后对外公开，才能教育后人”。做好收集、整理、修复、展览、研究等一系列保护管理工作，革命文物就能“有个家”，红色基因也能更好地代代相传。　　运用好革命文物，就能激活发展的正能量。《共产党宣言》的中译本，散发着“真理的味道”；《可爱的中国》手稿书写着初心使命，“每次读都受到启示、受到教育、受到鼓舞”；中国人民解放军进驻北京香山示意图，见证新中国的奠基，勉励我们“以‘赶考’的清醒和坚定答好新时代的答卷”……革命文物“会说话”，感染人、教育人，彰显了党在百年岁月中坚如磐石的理想信念和历久弥新的初心使命。这一精神力量也是经济社会发展的助推力。在“半条被子”故事发生地，湖南省汝城县沙洲村探索出“红色文旅+绿色产业+古色瑶乡”发展路子，让全面小康的活力更足、魅力更大。赤子之心不改，百年奋斗不息，从革命文物中汲取养分，积蓄新征程上的信心和斗志，党团结带领14亿人为之奋斗的伟大事业也会继续乘势而上，写下新的篇章。　　学史力行，鉴往知来。在江苏考察时，习近平总书记在淮海战役纪念馆内指出：“淮海战役就是小推车推出来的胜利。我们要好好回报人民，让人民过上幸福美好的生活。”从革命文物中感受百年峥嵘岁月，通过学党史悟思想办实事开新局，让信仰力量、无畏精神、深沉情怀直抵人心。以史为镜、以史明志，把人民对美好生活的向往作为奋斗目标，就要用党的光荣传统和优良作风坚定信念、凝聚力量，用党的实践创造和历史经验启迪智慧、砥砺品格。　　百年历史激荡，文物见证荣光。革命文物所蕴藏的精神财富跨越时空、熠熠生辉，激励人们风雨无阻、坚毅前行，照亮着奋斗新时代、启航新征程的前路。
2021年4月9日,7,评论,紧密合作 携手应对（人民时评）,http://paper.people.com.cn/rmrb/html/2021-04/09/nw.D110000renmrb_20210409_2-07.htm,沙尘天气再度提醒我们，沙尘暴等环境问题没有国界，各国需要更加紧密地合作，携手推进本地区和全球生态环境治理　　　　前不久，大范围沙尘天气过程影响我国北方地区。发生在3月份的两次沙尘天气过程，沙源地都主要在境外，影响范围很大，让我们对促进人与自然和谐共生、共建人类命运共同体重要性和紧迫性的认识，愈发深刻。　　历年来，我国高度重视生态文明建设，采取了一系列行之有效的举措，不断加强防沙治沙和荒漠化治理。从河北塞罕坝到山西右玉，从内蒙古库布其到新疆柯柯牙，广大干部群众坚韧不拔、锲而不舍，与沙害顽强抗争，取得显著成效，提前实现了联合国提出的到2030年实现土地退化零增长目标。监测数据显示，2004年以来，我国荒漠化和沙化土地面积连续3个监测期均保持缩减态势。随着从“沙进人退”到“绿进沙退”的历史性转变，近年来我国北方地区沙尘天气次数明显减少，强度明显降低，京津冀等地的人们很长时间没有遭遇过沙尘暴袭扰。在这样的背景下，最近的大范围沙尘天气让人们猝不及防。　　根据卫星影像和地面监测信息综合评估，近期两次大范围沙尘天气过程的沙源地主要在境外。这样的沙尘天气再度提醒我们，沙尘暴等环境问题没有国界，各国需要更加紧密地合作，携手推进本地区和全球生态环境治理。正如习近平主席在致《联合国防治荒漠化公约》第十三次缔约方大会高级别会议的贺信中所强调的：“防治荒漠化是人类面临的共同挑战，需要国际社会携手应对。”同处地球村，我们理应主动推广和分享防沙治沙和荒漠化治理的中国方案、中国经验，更好惠及其他国家，为建设清洁美丽的世界作出更大贡献。　　这次大范围的沙尘天气近年罕见，直接原因是近期大气环流形势出现异常，根本原因则是全球变暖加剧了气候系统的不稳定性，导致天气气候频频“走极端”。联合国政府间气候变化专门委员会（IPCC）评估报告指出，全球变暖导致一些地区暴雨、洪涝、干旱、台风、高温热浪、寒潮、沙尘暴等极端天气气候事件频繁发生，而且强度增大。大范围极端天气气候事件，给自然生态环境和人类经济社会带来了多方面的影响和风险。我们需积极应对气候变化威胁，攻坚克难打好实现碳达峰、碳中和目标这一硬仗。　　大范围沙尘天气还提醒我们，要牢固树立尊重自然、顺应自然、保护自然的理念，下大力气推进国土绿化高质量发展。沙地、沙漠无法被消除，而且初春北方地区植被还没有复绿，存在大面积的裸露土地，因此一旦强风刮起，沙尘天气就可能形成，这是无法避免的自然现象。我们能做的是，通过加强沙区防护林建设、生态保护修复，尽可能地降低沙尘天气的频次和强度。朝着我国在气候雄心峰会上作出的承诺进发，通过大规模、高质量的国土绿化，我们不仅可以减轻沙尘天气的危害程度，而且能够吸收、存储温室气体二氧化碳，减缓未来的气候变化。　　习近平主席在2019年中国北京世界园艺博览会开幕式上强调：“地球是全人类赖以生存的唯一家园。我们要像保护自己的眼睛一样保护生态环境，像对待生命一样对待生态环境，同筑生态文明之基，同走绿色发展之路。”加强生态保护国际合作，推动全球环境治理，坚定不移走生态优先、绿色低碳的高质量发展道路，才能实现人与自然和谐共生，让地球家园越来越宜居美丽。
2021年4月9日,7,评论,高度重视体育的育人功能（新论）,http://paper.people.com.cn/rmrb/html/2021-04/09/nw.D110000renmrb_20210409_3-07.htm,习近平总书记强调：“加强学校体育工作，推动青少年文化学习和体育锻炼协调发展，帮助学生在体育锻炼中享受乐趣、增强体质、健全人格、锻炼意志。”体育是教育的重要组成部分，其功能既包括锻炼身体、增强体质，也包括塑造品格、养成精神。　　长期以来，很多人只是将体育作为锻炼身体的一种手段。实际上，体育的育人功能才是最本质的功能，育人功能非常重要、不容忽视。正如教育家蔡元培所说，“夫完全人格，首在体育”。因此，我们不仅要重视体育强身健体的作用，更要发掘和弘扬体育的育人功能。　　体育的育人功能内涵丰富，关键是培养学生的体育精神。体育精神包括的内容很多，但主要内容有三条。第一，坚韧不拔的意志。体育是一项艰苦而愉悦的活动，追求的是更高更快更强。学生在体育运动中不仅面临体力上的考验，更要经受意志力的磨炼。体育没有捷径。唯有奋发向上、积极进取、艰苦训练、坚持不懈，才能取得进步，获得成功的喜悦。在体育运动中，学生要迫使自己走出“舒适圈”，走向运动场，向自己的惰性、体力、运动技能发起一次次挑战，在经年累月的坚持中挥洒汗水、磨炼意志和享受快乐，最终养成坚韧不拔的意志和乐观向上的品格。　　第二，团结协作的精神。团体体育项目要求每个成员齐心协力、团结协作、艰苦奋斗，充分发挥每个人的优势、特长和潜能，才能凝聚成强大的团队合力，在激烈竞争中脱颖而出。在学校教育中，学生们的学科学习考验的是个人学习能力，而体育运动则可弥补学科教育的不足，打破以自我为中心、孤军奋战的格局，增进集体凝聚力，培养学生团结协作精神，让学生拥有开放的心态和主动合作意识。当今时代，单打独斗已很难成功，唯有团结协作方可取得胜利。体育带给学生的团结协作精神，将使其在今后的工作和生活中更好地与人共处、与人交往、与人合作。　　第三，遵守规则的意识。体育运动有明确的竞技规则。规则面前人人平等。每个参与者都必须遵守规则，服从裁判。因此，体育是学生规则意识培养的重要途径。现代社会是法治社会，讲规矩、讲规则是合格公民的基本要求。在体育中养成的规则意识有助于培养学生对法律规范和社会公德的认同与遵循，从而促进学生成为自觉遵纪守法的好公民。　　总之，体育运动不仅有利于增强学生体质，而且对培育学生坚韧不拔的意志、团结协作的精神和遵守规则的意识有着不可替代的作用。从体育中获得的这些品质和精神将使学生受用终身。可以说，学校体育是落实立德树人根本任务、提升学生综合素质的基础性工程，对于培养学生奋发向上、顽强拼搏的意志品质具有独特功能，有助于实现以体育智、以体育心。因此，我们应在加强体育上下大力气，并基于育人功能设计和实施体育课的教学目标、教学内容和教学方法。只有这样，我们才能培养出担当民族复兴大任的社会主义建设者和接班人。　　（作者为武汉大学副校长、教授）
2021年4月9日,7,评论,图片报道,http://paper.people.com.cn/rmrb/html/2021-04/09/nw.D110000renmrb_20210409_4-07.htm,从考古现场空间信息的获取、制图，到数据库建设、空间分析与模拟、虚拟与增强现实展示，再通过网络通信进行数据传输与共享，数字考古为考古学研究、文化遗产保护、数据存档等开辟新空间，在提高考古工作分析能力和历史文化遗产保护能力等方面发挥着重要作用。　　这正是：　　应用信息技术，　　创新数字考古。　　科技作为工具，　　实现更好保护。　　曹??一图??羽??生文
2021年4月9日,7,评论,向大地播撒绿色的种子（暖闻热评）,http://paper.people.com.cn/rmrb/html/2021-04/09/nw.D110000renmrb_20210409_5-07.htm,【人物】“时代楷模”空军某运输搜救团一大队　　【故事】空军某运输搜救团一大队，长期担负飞机播种造林和防风治沙任务。他们在加强战备训练的同时，笃定让沙漠变绿洲信念，几十年如一日扎根荒漠、播撒绿色，为荒漠地区、沙漠地带筑起绿色屏障。党的十八大以来，他们矢志播绿助脱贫，飞播航迹遍布7省（区）130多个县（市），作业面积2600余万亩，播撒草籽树种万余吨，为绿化荒漠、打赢脱贫攻坚战、促进地方经济社会发展作出重要贡献。不久前，该大队被中共中央宣传部授予“时代楷模”称号。　　【点评】　　飞播，就是利用飞机播种，造林种草。在我国空军部队，有这么一群人，在天上播种，给荒漠点绿，用数十载春秋，创造了一个“绿色奇迹”，也帮群众摘掉了贫困帽子。驾机为犁耕大漠，这群“飞播绿鹰”用拼搏与付出，书写了生态扶贫的故事。　　青春献荒漠，绿色伴航程。39年里，空军某运输搜救团一大队官兵人不卸甲、马不卸鞍，把航迹留在大河上下、长城内外，把绿色希望播撒在荒漠戈壁、荒山秃岭。39年接续奋斗，几代飞行员几十年如一日，扎根荒漠；39年时节更替，戈壁滩黄沙变绿洲；39年光阴流转，群众脱贫奔小康。天空虽无痕，一粒粒叫作希望的种子由天而降，落地、生根、成长、壮大，戈壁沙滩终变充满生机的绿洲。　　变换的是大地的色彩，不变的是永恒的初心。39年里，他们听党指挥，奉献在荒漠中，“我们最大的幸运，就是肩负起为国奋飞为民造福的崇高事业，我为祖国去飞播，播绿生态为祖国”；践行为民宗旨，把人民的幸福安康放在心中最高位置，“干飞播造林，计利要计国家利，留名要留青山名”；加强练兵备战，勇于挑战极限、突破极限，在戈壁滩上、悬崖峭壁前刻苦训练、精益求精；发扬优良传统，自觉吃苦、甘愿吃苦，默默奉献、长期奉献，用帐篷做塔台、当宿舍，酷暑时节常常在闷热机舱一待就是十几个小时……　　付出有回报，初心见担当。老一辈飞播人说，“你飞的每一个架次，都要对得起良心，你播撒的每一粒种子，都该在它应该生长的地方。”正是有了对飞播的挚爱，才能战胜荒凉，播下希望；正是有了对使命的坚守，才能让荒漠变绿洲、让致富之路越走越长。　　面对艰苦恶劣的自然环境，中华民族从来都不缺乏改天换地的壮志豪情、战天斗地的昂扬斗志和感天动地的担当作为。河北塞罕坝机械林场三代建设者接续奋斗，创造荒原变林海的奇迹；甘肃八步沙林场“六老汉”三代家庭植树造林、战风斗沙，使古浪县风沙线后退了15公里。困难面前不低头，敢把沙漠变绿洲。尊重自然、科学治理，艰苦奋斗、甘于奉献，久久为功、驰而不息，就能够以保护环境、改善生态的实绩造福于民。　　装点此关山，今朝更好看。飞行员许彦龙喜欢带毛刺的沙拐枣，一根根毛刺就像太阳的光芒，也像平凡执着、刚毅锐气的飞播人。“飞播绿鹰”从空中向祖国大地播撒五彩斑斓的种子，花开草长、风吹绿浪，富足的土地正在孕育梦想。
2021年4月9日,7,评论,心中有信仰 脚下有力量（现场评论・奋斗百年路 启航新征程⑦）,http://paper.people.com.cn/rmrb/html/2021-04/09/nw.D110000renmrb_20210409_6-07.htm,崇尚英雄、缅怀先烈，激扬英雄精神、砥砺家国情怀，让理想之光不灭、信念之火不熄　　　　从打响武装反抗第一枪的南昌，到燃起星星之火的井冈山；从建立第一个红色苏维埃政权的瑞金，到开始二万五千里长征的于都……走进江西，重温一段段可歌可泣的红色历史，内心总会被一种力量震撼。每段故事，都让人热血澎湃。历经岁月沉淀，那些英雄形象如珍珠一般，熠熠生辉。　　在南昌八一起义纪念馆，一组关于贺龙元帅的文物引人注目。其中一张珍贵的党员登记表，填写细节格外动人，比如“动产、不动产、现金各多少”一栏，贺龙写到“什么都没有”；“在工农军政各界有什么社会关系？他们对革命的态度怎样？”一栏，他写到“以前的社会关系，参加革命后都不来往了”。这是革命者的坚定，也照见了一名共产党员的品格。　　英雄壮举，源自坚定如钢铁的信仰，千磨万击还坚劲。1927年南昌起义前，贺龙作为当时国民革命军第二十军军长，是很多力量争相拉拢的对象，但他不为所动。1927年7月28日，周恩来抵达南昌的第二天，便来到贺龙指挥部，将起义计划全盘告知，并传达中央决定，任命贺龙为代总指挥。当时还不是党员的贺龙斩钉截铁地说：“我完全听共产党的命令，党要我怎么干就怎么干。”心中有信仰，脚下有力量，正是有了牢不可破的理想信念，我们才能战胜一个个艰难险阻。　　英雄壮举，源自为国为民的赤子情怀，虽九死其犹未悔。1935年3月，红军已在长征途中，而奉命在苏区坚持斗争的赣南军区政治部主任刘伯坚，不幸被捕，就义前留下一封信，“生是为中国，死是为中国，一切听之而已。”在瑞金叶坪革命旧址，红军烈士纪念塔巍然耸立，前面的地面上铺着“踏着先烈血迹前进”八个苍劲大字，塔身镶嵌着密密麻麻的碎石，犹如为革命牺牲的烈士，让瞻仰者心情起伏、热泪盈眶。以天下苍生幸福为念，为崇高事业义无反顾，无数英烈用个人生命的“舍得”换人民群众的“获得”，在历史长河中汇聚起坚不可摧的前进力量。　　英雄的足迹，犹如夜空中闪闪发亮的灯塔，指引着前行之路。南昌起义失败后，陈毅诚恳地开导同志们，“只有经过失败考验的英雄，才是真正的英雄。”革命低潮时，面对“红旗还能打多久”的疑问，毛泽东同志用诗一般的语言阐明“革命高潮快要到来”――“它是站在海岸遥望海中已经看得见桅杆尖头了的一只航船，它是立于高山之巅远看东方已见光芒四射喷薄欲出的一轮朝日，它是躁动于母腹中的快要成熟了的一个婴儿。”而今，迎来从站起来、富起来到强起来的伟大飞跃，我们距离实现民族复兴的宏伟目标从未如此之近。“行百里者半九十”，实现既定奋斗目标还需要付出更为艰巨、更为艰苦的努力，还需要发扬英雄精神、激发奋斗热情。习近平总书记强调：“中华民族是英雄辈出的民族，新时代是成就英雄的时代。”回望百年党史，人们愈加强烈地感受到，今天尤须崇尚英雄、缅怀先烈，激扬英雄精神、砥砺家国情怀，让理想之光不灭、信念之火不熄。　　（作者为本报江西分社记者）
2021年4月12日,5,评论,勇于攀登航天科技高峰（人民时评）,http://paper.people.com.cn/rmrb/html/2021-04/12/nw.D110000renmrb_20210412_1-05.htm,面向未来，太空探索仍将是科学探索的有力牵引，中国探索太空的脚步更为坚定　　怀揣不懈追求的航天梦，敢于战胜一切艰难险阻，勇于攀登航天科技高峰，一步一个脚印开启建设航天强国和世界科技强国新征程，我们将向着更深更远的太空不断出发　　　　苍凉而广袤的火星逐渐进入视野，稀薄的大气层和火星表面形貌清晰可见，探测器上太阳翼的轻微震动，提醒人们这个壮丽的太空视角来自造访火星的地球航天器。不久前，我国首次火星探测任务“天问一号”拍摄的火星影像公布，让航天迷们扎扎实实过了把瘾。　　在航天迷看来，2021年是中国航天的“大年”。自开年以来，从长征七号改遥二运载火箭成功发射，到嫦娥五号轨道器飞抵距地球150万公里的日地引力平衡点，再到“天问一号”登陆火星、中国空间站核心舱发射等大动作的预告，激发起无数人对太空探索的热情和向往。　　探索浩瀚宇宙，是梦想的远航，也是创新的跋涉。刚刚过去的“十三五”，中国在太空探索领域取得了显著成绩，不断刷新纪录。从近地轨道到太阳系深处，中国航天器的队伍越来越大，足迹不断延伸。北斗、嫦娥、天宫、玉兔、天问……这些名字背后，是航天发射能力的显著提升，卫星、飞船等航天飞行器技术的持续进步，反映着从航天大国迈向航天强国的有力步伐。太空探索事业的突破和进展，不断夯实着创新型国家建设的丰硕成果。卓越不凡的创新进一步激起人们对星空的好奇，而这种热情的向往，无疑又会驱动着探索脚步不断前行。　　太空探索的进步不仅映照着“可上九天揽月”的豪情，也进一步增强了科技自立自强的信心和底气。经过一代代航天人接续奋斗、攻坚克难，我们取得了以载人航天、北斗导航、月球探测等为代表的标志性成就，不断实现着从无到有、从小到大、从弱到强的跨越发展。至今环绕地球飞行的东方红一号卫星，仍在月球上“日出而作、日入而息”的玉兔号月球车，以及即将踏上火星表面的中国火星车，它们在地球外探索的勇敢身影，凝结着中国航天人坚持走自主创新之路的汗水和智慧，体现着中国科技强起来的决心和勇气。　　面向未来，太空探索仍将是科学探索的有力牵引，中国探索太空的脚步更为坚定。宇宙起源与演化等基础科学研究，探月工程四期、火星环绕、小行星巡视等星际探测，和新一代重型运载火箭和重复使用航天运输系统研制、北斗产业化应用等，都已被列入相关规划之中。预计2022年前后建成的中国空间站，作为国家级太空实验室，将为科学家们提供极其宝贵的科学实验平台，有望产生重大的科学突破。可以说，对宇宙奥秘的探究和对深空的探测，将继续牵引科学的进步和科技的发展。　　面对浩瀚宇宙，人类是渺小的，但人类的探索精神是伟大的。一代代中国航天人以追逐梦想的热情和坚忍不拔的壮志，创造出“两弹一星”精神、载人航天精神、北斗精神和探月精神，丰富了中华民族的宝贵精神财富，彰显了坚定的中国特色社会主义道路自信、理论自信、制度自信、文化自信。怀揣不懈追求的航天梦，敢于战胜一切艰难险阻，勇于攀登航天科技高峰，一步一个脚印开启建设航天强国和世界科技强国新征程，我们将向着更深更远的太空不断出发。
