date,page,tag,title,url,content
2021年4月23日,5,评论,推进全民阅读 建设书香社会（评论员观察）,http://paper.people.com.cn/rmrb/html/2021-04/23/nw.D110000renmrb_20210423_1-05.htm,人们在阅读中思考，增添知识的养分，汲取前行的力量　　阅读有益于获取知识、增长智慧，是传承文化、陶冶情操的重要途径　　读书的价值不仅体现在连通过去、观照现在，还在于能够发现和创造未来　　　　春暖花开，正值读书好时节。伴随着琅琅书声、浓浓墨香，第二十六个世界读书日如约而至。从地铁图书漂流到图书馆奇妙夜，从“悦读”分享会到经典公开课……人们在阅读中思考，增添知识的养分，汲取前行的力量。　　习近平总书记强调：“要提倡多读书，建设书香社会，不断提升人民思想境界、增强人民精神力量，中华民族的精神世界就能更加厚重深邃。”多读书、读好书、好读书，正在成为越来越多人的共同选择。正因如此，不少人都在每年读书日前后反思：“多长时间没有好好读一本书了？”生活里，一些人书单列了长长一串，书架摆得满满当当，但买来的书只是随手翻翻而已。网络时代信息爆炸，曾经的卷帙浩繁、汗牛充栋早已化作一段段消息、一条条链接，那种字里行间的品悟、咬文嚼字的细致似乎太“传统”了。然而，果真如此吗？　　沁人的墨香，令人心驰神往。一名农民工的告白情深意切：“我来东莞17年，其中来图书馆看书有12年，书能明理，对人百益无一害的唯书也……想起这些年的生活，最好的地方就是图书馆了”。一名作家的描述启人深思：“书林是一个最可逛，最应该逛的地方，景色无边，奇妙无穷。”阅读有益于获取知识、增长智慧，是传承文化、陶冶情操的重要途径。不妨在一个鸟鸣的清晨，或是雨后的黄昏，抑或静谧的深夜，打开一本书、开启一场对话，在时间的流动中感受读书的力量。　　“智者阅读群书，亦阅历人生。”读书能让我们遇见有趣的灵魂，探寻更高远的境界。有人打过一个比方：读书如交友，好书如知己。读一本好书，不亚于跟智者来一场对话。在历史传记的跌宕起伏里，感受斗转星移的变与不变；在科学哲思的缜密推演中，发现世界运转的知与未知；在诗歌文学的悲欢离合间，体味百态人生的是与非。透过薄薄的纸张、激扬的文字，阅读使我们思接千载、心通万里，与先贤畅谈、和自我对话，构筑起一个日渐丰满的精神世界。　　阅读是精神的反映，也是现实的投射。有调查显示，新冠肺炎疫情防控期间，不少人的阅读量有所增加。从严峻的考验到胜利的曙光，从英雄的传奇到个体的故事，我们从这些作品中读出了坚韧、萌生了思考、寻觅到希望。由此不难理解，人们为何会对方舱医院里躺在病床上手不释卷的患者充满敬意，为何会对夕阳下医生和病人共赏日落的身影充满感动，为何会对盛开的樱花、喧闹的街市充满深情。　　“推进城乡公共文化服务体系一体建设，创新实施文化惠民工程，倡导全民阅读。”今年全国两会上，“全民阅读”再次被写入《政府工作报告》。从更长远来看，读书的价值不仅体现在连通过去、观照现在，还在于能够发现和创造未来。当人工智能走进千家万户，当新能源汽车驶向更远的地方，当区块链技术在更多领域延伸……在一个知识更新和认知迭代交织、科学进步和技术革新叠加的时代，每时每刻都需要学习，每个人都面临着“重新发现自己”的挑战。从某种意义上说，阅读正是刷新自己、发展自己的成长方式。持续追求、不断探索，我们才能在认识世界和改造世界的过程中拥抱更多可能性。　　当前，全党正在开展党史学习教育。在青海西宁，“学党史・忆征程・增党性”知识问答活动火热进行；在山西太原，“马克思主义传播在中国”文献中的百年党建主题展向公众开放；在上海虹口，“力量之源・阅读启程”红色阅读行走活动如期举行……在党史学习教育过程中，倡导多读书、勤学习，能够更好营造全民阅读氛围，共同建设书香社会，为奋斗“十四五”、奋进新征程注入强大精神力量。
2021年4月23日,5,评论,增强职工基本医保互助共济保障功能（人民时评）,http://paper.people.com.cn/rmrb/html/2021-04/23/nw.D110000renmrb_20210423_2-05.htm,相关改革举措，有利于进一步减轻患者负担，优化医保结构，更好化解疾病给家庭带来的经济风险，实现医保互助共济的功能，提高医保基金使用效率　　　　医疗保障工作社会关注度高、与群众切身利益联系紧密，是一项重大民生工程。我国新一轮医改建立了世界上规模最大、惠及10多亿人的基本医保网，对减轻群众就医负担、缓解看病贵发挥了重要作用。　　前不久召开的国务院常务会议明确，下一步要深化医改，增强职工基本医保互助共济保障功能，将更多门诊费用纳入医保报销。近年来，居民医保已经普遍开展普通门诊统筹，各地还根据实际情况，将部分慢性病和特殊疾病的门诊费用纳入职工医保和居民医保报销范围。今后，常见病、多发病的普通门诊费用将纳入职工医保统筹基金支付，政策范围内支付比例从50%起步，同时还会加强门诊慢特病保障，进一步减轻患者负担。这对患病多的参保群众来说，是一个福音。　　早在1998年，我国就建立了城镇职工基本医保制度，实行统筹基金与个人账户相结合的统账结合，目前参保人数已达3.4亿人。个人账户是职工医保特有的政策设置，主要用于覆盖参保职工在门诊看病费用。随着老龄化不断加快，疾病谱发生变化，我国高血压、糖尿病、冠心病等患病人数迅速增加，身体欠佳、经常患病的职工医保参保人需长期在门诊定期复诊、买药，个人账户金额较少，往往不够用。虽然各地普遍开展了门诊慢性病、特殊病、大病等专门的报销办法，来缓解门诊负担较重的问题，但仍有大量患者达不到门诊报销要求，但又不需住院治疗。2019年，国家医保局等四部门联合印发《关于完善城乡居民高血压糖尿病门诊用药保障机制的指导意见》，针对城乡居民参保人群中高血压、糖尿病“两病”患者，明确他们在二级及以下定点基层医疗机构看门诊开降压药、降糖药，可进行医保报销。此次国务院常务会议明确，让职工医保参保人也能享受普通门诊报销的实惠，意味着相关人群的看病负担将进一步减轻。　　一些经常患病的参保人个人账户资金不够用，与此同时，大量职工参保人个人账户资金常年沉淀。这部分人主要是比较健康的年轻职工，他们一年看不了几次病，几乎不动用个人账户资金。国务院常务会议明确，拓宽个人账户使用范围，允许家庭成员共济，可用于支付在定点医疗机构就医，以及在定点零售药店购买药品、医疗器械和医用耗材发生的由个人负担费用，探索用于家属参加城乡居民基本医保等个人缴费。这意味着年轻职工个人账户沉淀的资金将被盘活，得到有效利用。比如，患病的父母可以用子女个人账户去看病、买药。这一举措，有助于优化医保结构，更好化解疾病给家庭带来的经济风险，实现医保的互助共济功能，提高医保基金使用效率。　　将更多门诊费用纳入职工医保报销和个人账户家庭共济两类改革同步推进，让患者享受到门诊报销的待遇，家庭成员享受到个人账户的共济使用便利，体现了医保互助共济的功能和价值。改革策略积极稳妥，提升了门诊报销待遇，体现了权益置换、政策协同等原则。此前，上海、福建三明等地积极探索门诊统筹，受到欢迎。相信随着门诊统筹政策的完善、待遇的提高，职工医保参保人在门诊就医时可得到更多实惠。　　“利民之事，丝发必兴”。不断把群众的期盼点变成医保改革的着力点，医保改革就能不断取得新突破、带来新亮点。相信随着经济社会的不断发展，医保门诊、住院报销政策的逐步完善，我国医保待遇保障水平必将日益提升，更好守护群众的生命健康，不断增强人们的获得感、幸福感、安全感。
2021年4月23日,5,评论,阅读的陪伴最温情（金台随笔）,http://paper.people.com.cn/rmrb/html/2021-04/23/nw.D110000renmrb_20210423_3-05.htm,爱上阅读，各有各的因由，各有各的精彩。阅读是以认知的力量去探测世界的广袤，借伟岸的灵魂来陪伴心灵的成长。阅读之于个人，如漫漫人生里的灯盏，照亮奋斗之路；阅读之于社会，如历史进程中的星光，辉映壮美的文明之虹。　　先哲有言：“人有知学，则有力矣”。阅读是秉心之烛火，去探访古今智者仁人的精神空间。依靠阅读，我们可以收获超出自身阅历的风景，领略更辽阔、更深邃的精神世界。可以说，人类的思想足迹有多远，阅读的空间就有多广；人类的精神维度有多丰富，阅读的世界就有多瑰丽。有书做伴，生命便不会失色暗淡；有书壮怀，灵魂便不会孤寂渺小。每个人的精神成长，人类文明的发展进步，仿佛一场登山，需要阅读这根登山杖的助力。阅读，塑造了我们更加高远的人生境界，也构筑起一个社会更加绚烂的精神胜景。　　腹有诗书气自华，一个人的气质里藏着读过的书、走过的路。阅读是看不见的精神修炼，是为人生绘就底色的事业。阅读往圣哲思，心灵深处不觉增添了参悟世界的思想之力；阅读唐诗宋词，胸中悄然生发俯仰天地的文化豪情；阅读红色经典，感悟革命先辈的家国情怀，心中自然涌起蹈厉抗争的斗争气概和为国为民的奋斗热情。各类经典著作浓缩了历史的精华、文明的智慧，每读一次都会有新的收获。阅读的回馈是丰厚的，含英咀华不仅口齿生香，思想和心志也会充满澎湃能量。　　阅读是有情怀的文化体验，是有温度的精神旅行。无论世事怎么变化、人生如何起伏，阅读都是我们最好的陪伴。窗前灯下，一段段暖心的故事，湿润了多少儿童的双眸；大山深处，一册册趣味无限的绘本，带给多少学子以情感和美感的启迪；晚高峰的地铁里，手机中的网络文学，治愈了多少上班族的疲乏困倦；医院的病榻前，一卷卷直击心灵的人文经典，让多少病患舒展开紧锁的眉头。世间万物往往纷纭不定，人生在世难免起起落落，而阅读的陪伴最恒久也最温情。人们总能在阅读中得到慰藉和滋养，收获内心的充实和温暖。　　李大钊提出过这样一个生动形象的比喻：“知识是引导人生到光明与真实境界的灯烛。”书是沟通古今的纽带、交流文明的津梁。古今多少梦想与奇迹、伟业与壮举、荣耀与辉煌，都成为了历史、写进了书册，成为点亮心中梦想的星星之火，化作驱散严寒的浩荡长风，激发从逆境中奋进的精神动能。思接千载、情通古今，经典以其通达启迪了我们的思想，以其至善滋养了我们的心境，以其壮丽充盈了我们的精神，以其厚重丰富了我们的灵魂。阅读经典，赋予我们更加豁达睿智、自信从容的奋斗姿态，为我们注入更加笃定刚毅、雄浑强健的前行之力。　　阅读是历史的回望、心灵的净化，也是梦想的启示、希望的播撒；是思想的觉醒、精神的刷新，更是文明的接力、文脉的传承。因为阅读，我们不断成为更好的自己，也因为阅读，人类不断创造更美的世界。
2021年4月23日,5,评论,图片报道,http://paper.people.com.cn/rmrb/html/2021-04/23/nw.D110000renmrb_20210423_4-05.htm,为打通惠农服务“最后一公里”，浙江省农信系统自2015年起，在全省各地农村建设集金融、电商、物流、民生、政务服务于一体的“丰收驿站”。除了现金存取等金融类业务，驿站还可提供养老金办理、涉农补贴领取等各类服务。村民足不出村，就能享受到方便快捷的一站式服务。　　这正是：　　服务集于一体，　　办事不出村里。　　多谋民生实利，　　当从小处做起。　　曹希阳图??万??泉文
2021年4月23日,5,评论,创新方式讲好沂蒙故事,http://paper.people.com.cn/rmrb/html/2021-04/23/nw.D110000renmrb_20210423_5-05.htm,2013年11月，习近平总书记在山东临沂考察时指出：“沂蒙精神与延安精神、井冈山精神、西柏坡精神一样，是党和国家的宝贵精神财富，要不断结合新的时代条件发扬光大。”把沂蒙精神发扬光大，沂蒙故事是重要载体。真实再现红色沂蒙的历史与文化，需要创新讲述方式方法、完整体现精神气质，紧密联系现实将沂蒙精神讲明白、讲清楚。　　讲好沂蒙故事，更好呈现党领导沂蒙人民进行革命、建设、改革的伟大历程和新时代的伟大实践。从“沂蒙母亲”王换于、乳汁救伤员的“红嫂”明德英，到“模范烈属”李凤兰；从孟良崮战役“大军联营七百里，村村灯火到天明”的支前热情，到传承沂蒙精神的“南京路上好八连”连长张继宝，再到四川凉山木里大火中牺牲的5位来自山东临沂、滨州的年轻消防员……沂蒙故事展现信仰与意志、宗旨与情怀，沂蒙精神是由此形成的经验与认识、品格与气质。　　讲好沂蒙故事，立体、全面展示党带领人民迎来从站起来、富起来到强起来的历史性飞跃的基本逻辑。鲁南区委书记赵D，在刑场上做了最后一次演讲：“我从入党那天起，就做好了准备，为了人类解放和壮丽的共产主义事业，随时准备牺牲自己的生命”。“枪声就是命令”的朱村保卫战，“钢八连”战士们破冰过河保卫乡亲们生命安全……讲好这些鲜活的故事，思考“为了谁、依靠谁、我是谁”的答案，有助于深刻领悟中国共产党为什么能、马克思主义为什么行、中国特色社会主义为什么好。　　讲好沂蒙故事，展现故事深处的不朽灵魂、沂蒙精神的时代价值。在抗日战争最艰苦的时期，中国共产党已拥有了先进的思想理论武装，正在唤起民众，成为茫茫黑夜中的闪亮星光。1940年，红色经典歌曲《跟着共产党走》在沂南县孙祖镇一个叫东高庄的小山村诞生，展现出党和人民的鱼水情深、生死与共，以及老百姓坚决跟党走的信念，历经时代变迁却始终鲜活。讲述这样的故事，重在让沂蒙精神更可感更可触，更有温度更有情怀，更利于理念的传递与浸润。　　蒙山沂水，故事铿锵；百年历程，精神无价。沂蒙故事承载沂蒙精神，沂蒙精神升华沂蒙故事。全方位、大视野、多角度地呈现沂蒙大地发展与进步的故事，阐发沂蒙精神及这份精神财富中蕴含的红色基因，有利于我们在新时代凝聚起从苦难中铸就辉煌、绝境中涅重生、挫折中顽强奋起、奋斗中创造奇迹的强大力量。讲好沂蒙故事、弘扬沂蒙精神，“知所从来，明所去处”，我们就一定能增强开拓奋进的勇气和信心，以自我革命、矢志创新的精神把我们党建设得更加坚强有力。　　（作者为沂蒙干部学院副教授）
2021年4月23日,5,评论,精准揽才开新局（现场评论・为“十四五”开好局起好步③）,http://paper.people.com.cn/rmrb/html/2021-04/23/nw.D110000renmrb_20210423_6-05.htm,多元丰富的人才队伍与产业发展、科技创新同频共振，为推动高质量发展汇聚起澎湃动力　　　　知识就是力量，人才就是未来，创新事业呼唤创新人才。在实践中发现人才、在发展中培育人才、在事业里凝聚人才，方能以人才荟萃的资源优势更好为“十四五”开局起步。　　习近平总书记在江苏考察时强调：“要全面把握新发展阶段的新任务新要求，坚定不移贯彻新发展理念、构建新发展格局”。面向“十四五”，推动经济社会高质量发展、可持续发展，离不开高素质、高层次人才。前不久，江苏南京和镇江两市同时发布全球揽才计划，吸引不少关注目光。　　南京向各类人才发放紫金山英才卡，首期提供涵盖社会保障、教育医疗等60项服务；在镇江，顶尖人才将获1000万元资金支持，且上不封顶……在发布会现场，一项项揽才政策“给待遇、给尊重、给环境”，一些地方还将人才父母的养老问题考虑在内，足见吸纳人才、留住人才的诚意。　　对人才的需求，折射出推进高质量发展的迫切要求。江苏GDP已迈上10万亿元台阶，贯彻落实好习近平总书记对江苏提出的“在改革创新、推动高质量发展上争当表率，在服务全国构建新发展格局上争做示范，在率先实现社会主义现代化上走在前列”重要指示精神，必须进一步转变发展方式、优化发展思路。为此，江苏提出加快建设“一中心一基地一枢纽”的思路，即深化建设具有全球影响力的产业科技创新中心、全力打造具有国际竞争力的先进制造业基地、积极构建具有世界聚合力的双向开放枢纽。以此为抓手，争创高质量发展新优势，人才是关键中的关键、重点中的重点。　　揽才，贵在精准。镇江此次对产业创新人才的诉求强烈，很大程度缘于当地在精准引入顶尖人才上曾经受过益。镇江丹阳有一家企业，产品行销150多个国家和地区，全球业绩持续上扬，一个重要原因是该公司借力当地人才政策，引进国家级专家作为技术总监，攻克了粉末冶金领域的关键技术，在国际市场有了话语权。引人就是引“智”，揽才就是汇“贤”。培养、引进、用好当地发展迫切需要的高精尖人才，精准激发人才创新活力，才能让产业立于市场不败之地，让发展不断厚植竞争优势。　　揽才，也应多元。“用一贤人则群贤毕至，见贤思齐就蔚然成风。”要努力创设条件，让符合时代发展需要的人才都能才尽其用。为此，江苏注重多层次、宽领域的揽才布局，将青年大学生纳入大力招引的范围。例如，南京布局建设“海智湾”国际人才街区，面向全球招揽高层次产业人才和世界高水平大学、研究机构青年留学人才，镇江也提出“5年集聚30万名青年人才”的目标。从实用技术技能人才到专业人才，从创新人才到领军人才，多元丰富的人才队伍与产业发展、科技创新同频共振，为推动高质量发展汇聚起澎湃动力。　　聚天下英才而用之，继续创造有利于人才成长发展的良好环境，用好用活人才，就能成就“千里马竞相奔腾”的气象，在新征程书写新的璀璨篇章。　　（作者为本报江苏分社记者）
2021年4月26日,5,评论,“永远跟党走”，吹响接续奋斗的号角（评论员观察）,http://paper.people.com.cn/rmrb/html/2021-04/26/nw.D110000renmrb_20210426_1-05.htm,最伟大的力量源于人民，有了人民群众的拥护和支持，我们就有了不断从胜利走向胜利的底气　　把苦难辉煌的过去、日新月异的现在、光明宏大的未来贯通起来，就能让人们自觉将热情转化为“听党话、跟党走”的实际行动　　　?　　“没有共产党就没有新中国……”随着党史学习教育的开展，熟悉的旋律不时萦绕耳畔。历经岁月的洗礼，这首红色歌曲至今仍广为传唱。人们从歌声中感悟信仰力量，激扬奋斗热情，唱出了只有中国共产党才能领导中国人民争取国家独立、民族解放、人民幸福的历史必然，更唱出了对我们党一如既往的拥护和“永远跟党走”的坚定信念。　　今年是中国共产党成立100周年。不久前，中共中央办公厅印发《关于庆祝中国共产党成立100周年组织开展“永远跟党走”群众性主题宣传教育活动的通知》，强调要组织开展形式多样、内容丰富的群众性主题宣传教育活动，大力唱响共产党好、社会主义好、改革开放好、伟大祖国好、各族人民好的时代主旋律。　　“永远跟党走”，源于不变的初心。“最后一碗米送去做军粮，最后一尺布送去做军装，最后一件老棉袄盖在担架上，最后一个亲骨肉送去上战场”。生动的民间歌谣，饱含着革命战争年代人民踊跃支前的热情。江西瑞金华屋村红军祠主墙上，镌刻着“永远热爱党、永远跟党走”十个大字，洋溢着摆脱贫困、逐梦小康的喜悦，表达着村民对新时代最真挚的情意。百年征程波澜壮阔，百年初心历久弥坚。我们党的百年历史，就是一部践行党的初心使命的历史，就是一部党与人民心连心、同呼吸、共命运的历史。特别是党的十八大以来，以习近平同志为核心的党中央坚持以人民为中心的发展思想，把增进人民福祉、促进人的全面发展作为发展的出发点和落脚点，推动全面建成小康社会取得伟大历史性成就，脱贫攻坚战取得全面胜利。正因为不忘初心、牢记使命，中国共产党始终得到人民的拥护和支持。　　“永远跟党走”，蕴含人民的伟力。回望历史，淮海战役的胜利，是老百姓用小推车推出来的；渡江战役的胜利，是老百姓用小船划出来的；热火朝天的社会主义建设，是老百姓撸起袖子干出来的；改革开放的伟大事业，是亿万人民满怀激情创造出来的……正是因为广大人民群众始终坚定“听党话、跟党走”，风雨无阻向前进，我们才能凝聚起强大的奋进力量，迎来从站起来、富起来到强起来的伟大飞跃。最伟大的力量源于人民，有了人民群众的拥护和支持，我们就有了不断从胜利走向胜利的底气。14亿中国人民听党指挥、团结一心，就没有任何力量能够阻挡我们前进的脚步。　　“永远跟党走”，吹响接续奋斗的号角。习近平总书记深刻指出：“赢得人民信任，得到人民支持，党就能够克服任何困难，就能够无往而不胜。”今年是“十四五”开局之年，全面建设社会主义现代化国家新征程已经开启。在这样的时间节点上庆祝党的百岁生日，就是要通过百年的辉煌成就、党群鱼水情深的故事，激发全体人民爱党爱国爱社会主义的热情，进一步凝聚开拓奋进、攻坚克难的力量。各地以此为契机，结合党史学习教育，创新方式方法，多用群众喜欢听、听得进的语言，多建群众爱参与、能参与的平台，组织开展各类特色鲜明的活动，把苦难辉煌的过去、日新月异的现在、光明宏大的未来贯通起来，就能让人们产生情感共鸣，自觉将热情转化为“听党话、跟党走”的实际行动。　　胸怀千秋伟业，恰是百年风华。讲好百年故事，传承红色基因，我们就一定能为“十四五”开好局、起好步凝心聚力，以昂扬姿态奋进全面建设社会主义现代化国家新征程，不断书写新的历史、创造新的辉煌。
