"date","page","tag","title","url","content"
"2021年04月21日","19","消费","快递过度包装不可取（市场漫步）","http://paper.people.com.cn/rmrb/html/2021-04/21/nw.D110000renmrb_20210421_2-19.htm","妥善解决快递过度包装问题，已成为行业转型升级、可持续发展的内在要求。要完善管理机制，更新技术手段，转变消费观念，让轻包装、简包装、循环利用包装材料成为新风尚　　　　大盒套小盒，包装盒里塞满塑料泡沫，撕开层层包裹才看到商品……这样的情景不少消费者已不陌生。近年来，随着网络购物快速发展，收快递早已成为人们的日常生活场景，快递过度包装问题也随之显现。　　快递包装的必要性毋庸置疑，适度的包装可以在运输中起到保护商品的作用，减少商品损伤与浪费。但在现实操作中，由于运输、搬运等环节的不确定性，为了确保商品安全，一些商家往往简单地选择增加外包装，逐渐演变成过度包装。　　过度包装不仅增加了商家、快递物流企业的经营成本，也带来了一些负面的溢出效应。一方面，过度包装会带来资源浪费，里三层外三层的包裹需要消耗大量纸张、胶带、塑料泡沫等材料，同时也会导致商品体积过大，带来运输空间的浪费。另一方面，过度包装会增加垃圾处理的工作量和环境污染，快递包裹所耗用的胶带、塑料泡沫运送到消费者手中往往会被丢弃变成垃圾，此类垃圾难处理、难降解，会给生态环境带来较大的负面影响。　　目前，我国快递业日均业务量超过2.4亿件、日均服务用户近5亿人次，已连续多年位居世界第一。妥善解决快递过度包装问题，已成为行业转型升级、可持续发展的内在要求。　　解决快递过度包装问题，相关部门已经在行动。去年3月，国家市场监管总局、国家邮政局印发《关于开展快递包装绿色产品认证工作的实施意见》，当年10月，《快递包装绿色产品认证规则》发布，获得绿色认证的快递包装产品意味着满足了资源节约、环境无害、消费友好等方面的要求。今年3月12日，《邮件快件包装管理办法》正式施行，明确了包装选用要求，包括建立实施包装物管理制度、按规定使用环保材料、包装减量化措施等，同时鼓励寄递企业建立健全工作机制和回收流程，对包装物进行回收再利用。　　管理机制更健全，技术手段也要跟上。快递包装既要保障商品安全，也要避免浪费，如何在二者中寻求平衡点，这对物流配送企业提出了更高的要求。物流配送企业应加大与包装生产企业、科研院校等合作力度，加强产学研衔接，促进快递包装产品、技术、模式的创新和应用，探索研发更绿色环保、可循环使用的包装材料，提升包装的自动化、信息化和智能化水平，用数字化技术实现高效环保的包装。　　解决快递过度包装问题非朝夕之功，需要各有关方面和消费者共同努力。消费者要自觉抵制过度包装行为，加快形成绿色消费理念，让轻包装、简包装、包装材料循环利用成为新风尚。"
"2021年04月21日","19","消费","老字号企业整体呈现良好发展势头（市场资讯）","http://paper.people.com.cn/rmrb/html/2021-04/21/nw.D110000renmrb_20210421_3-19.htm","本报电  商务部日前对1128家中华老字号企业经营情况的调查显示，84%的企业处于盈利状态。　　商务部调查数据显示，年营业收入达5000万元以上的中华老字号企业占比接近50%。同时，中华老字号企业总体利润率达2.7%，半数企业利润率超6%。一大批老字号企业市场竞争力不断增强，品牌影响力明显提升，整体呈现良好发展势头。　　老字号是民族品牌的集中代表和中华优秀传统文化的重要传承载体，目前广泛分布于食品餐饮、工艺美术、居民服务等20多个行业。　　为充分发挥老字号全面促进消费、弘扬优秀传统文化的作用，更好满足人民日益增长的美好生活需要，商务部日前印发通知，部署2021年“老字号嘉年华”系列活动，围绕“国潮国货 品质生活”主题，重点打造消费促进和宣传推广两类活动。　　据悉，活动将围绕“五一”、端午、七夕、中秋、国庆等节日，聚焦首届中国国际消费品博览会等重要展会，配合全国消费促进月等重点活动，实现商务主管部门、电商平台、主流媒体、专家学者、老字号企业五方联动，线上线下同步开展。　　（文利民）"
"2021年04月21日","19","消费","智慧旅游开启“加速跑”（消费万花筒）","http://paper.people.com.cn/rmrb/html/2021-04/21/nw.D110000renmrb_20210421_4-19.htm","“关注‘凤阳旅游’微信公众号，不仅可以购买景区门票、办理景区年卡，还能在景区享受在线导览讲解服务，既方便又有新意。”近日，在安徽凤阳县钟楼景区，来自安徽蚌埠市的游客杨阳对智慧旅游新体验连连点赞。　　杨阳说，几年前来凤阳旅游时，景区只有窗口售票，景区停车也是人工收费，无论在景区售票区还是停车场都常常见到游客排长队。今年再来，景区实现了网上订票、扫码入园，停车场也更加智慧：入口闸机上有一个显示屏，实时更新停车位剩余情况，出口升级为电子不停车通行系统，基本不用排队，游览畅通多了。　　“智慧化的景区不仅更方便了，也更好玩了。”杨阳说，行走在凤阳的景区，可以随时连接景区提供的免费无线网络，享受在线导览服务。来小岗村之前，杨阳就带着上小学五年级的女儿在线浏览了“360度全景看小岗”的虚拟现实全景图，看了大包干纪念馆等景点的全貌。到小岗村实地参观时，见女儿对院子里展示的当年用过的农具很感兴趣，杨阳连接上景区无线网络、扫描二维码，就可以让孩子在手机里听到语音讲解。　　“十四五”规划纲要提出，深入发展大众旅游、智慧旅游，创新旅游产品体系，改善旅游消费体验。当前，以数字化、网络化、智能化为特征的智慧旅游迎来新的发展机遇，正开启“加速跑”。线上门票预约，扫码进景区参观，节省排队时间；景区智慧化管理，提升服务质量，丰富游览体验；景区拥抱新技术，云旅游、云演艺、云展览等新业态快速发展……中国旅游研究院近日在全国“互联网+旅游”发展论坛暨河南智慧旅游大会上发布的《全国“互联网+旅游”发展报告（2021）》显示，春节期间全国景区接待预约游客的比例高达60%，平时也达40%至50%，在线旅游消费总额已达万亿元级。　　文化和旅游部相关负责人表示，各地积极探索智慧旅游公共服务平台模式，“一机游”“一码游”等在全国遍地开花，为游客提供多元化体验和服务，但仍不同程度存在“重建设、轻运营”“重面子、轻实效”等问题。为此，文化和旅游部将以提升便利度和改善服务体验为导向，着力厘清政府公共服务与市场旅游信息服务边界，提升平台服务效能，实现可持续运营与发展。同时，在为老年人等群体保留线下服务的基础上，优化平台使用体验。　　文化和旅游部等十部门去年联合印发的《关于深化“互联网+旅游”推动旅游业高质量发展的意见》明确提出，到2022年，建成一批智慧旅游景区、度假区、村镇和城市；国家4A级及以上旅游景区、省级及以上旅游度假区基本实现智慧化转型升级。下一步，文化和旅游部、国家发展改革委将会同相关部门，加强跟踪分析和协调指导，协同深化“互联网+旅游”，加快推进智慧旅游发展。"
"2021年04月22日","10","经济","外贸企业在这里加速成长（构建新发展格局·一线看外贸）","http://paper.people.com.cn/rmrb/html/2021-04/22/nw.D110000renmrb_20210422_1-10.htm","核心阅读　　出口总额位居浙江省第二，跨境电商出口总额保持省内第一……2020年，金华市交出了一份亮眼的外贸成绩单。走进金华，一系列稳外贸政策和服务更加全面精准，外贸企业从卖产品到创品牌，进一步向高质量发展迈进，成为促进经济企稳回升、持续向好的重要力量。　　　　出口总额位居浙江省第二，跨境电商出口总额保持省内第一；全年“义新欧”中欧班列开行数超过前6年运量总和，占全国份额排位上升至第四位……　　作为一个不临边不靠海的浙江中部城市，金华市交出了一份亮眼的2020年外贸成绩单。外贸企业如何加速成长？政府服务如何不断优化？记者来到这里的工厂车间、园区场站一探究竟。　　从卖产品到创品牌，市场主体更活跃　　在浙江立久佳运动器材有限公司的生产车间里，工人们正在有条不紊地忙碌着。眼下他们生产的订单，还是去年年底接到的。“新冠肺炎疫情虽然对海外消费市场影响很大，但健康消费的需求在不断增长，现在我们的跑步机更好卖了。”立久佳董事长方恬说。　　在海外从事运动产品代理工作时，方恬敏锐地发现当地居民的居家运动需求。2006年，他回国创业，开始有针对性地生产家用跑步机。如今，产品已经销往81个国家和地区，年出口额达到6258万美元。　　如果说立久佳的成长是基于海外经销的经验，在金华，还有不少企业是从传统的内销制造业企业起步，一步步迈向海外。　　“我们最开始是在外地设厂生产户外家具。几年下来，国内市场的竞争越来越激烈，一方面是利润空间收窄，另一方面是找不准中长期发展的方向。”在金华润程电子商务有限公司总经理唐文芳看来，走上跨境电商这条路，是一种必然。　　受益于本地良好的外贸基础设施建设和营商环境，金华已经成为外贸企业生产经营的重要成长地。数据显示，2020年，金华新增外贸市场主体2856家，新增开展跨境电商业务的制造业企业超过1100家。　　最近，除了协调产品的外销运力，方恬还在忙另一件事情。金华永康市政府正探索打造“永康五金海外品牌基地”，通过在海外设立中心站、由专业团队运营的方式，让永康制造业企业能够共享展厅、客服、仓库、物流和售后维修保障团队。经过测算，方恬愿意拿出3%的利润来运营一支力量过硬的海外售后团队。“我们的产品很受欢迎，再加上售后的保障，能帮我们打出更响亮的品牌。”　　从教开店到稳经营，政府服务更精准　　从为外国品牌贴牌生产，到主打自主品牌的跨境电商，中国企业想更好地走出去，难在哪里？　　在金华市跨境电商综合服务中心副主任周伟瀚看来，让制造业企业转变思路，主动寻求和接受跨境电商的改变，才是最难的。　　作为由政府主导成立的公共服务平台，2020年5月成立的金华市跨境电商综合服务中心承担着跨境电商孵化的任务。当时，跨境电商业务已经在国内风生水起，但一些中小微制造业企业还是只愿意守着国外订单，做着代工生意。　　“尽管培训费用由政府全额补贴，不少中小微制造业企业还是对长达10至12周的培训周期有顾虑，不愿意投入人员参加培训。”周伟瀚说，在政府的不断引导鼓励和综合服务中心工作人员的反复沟通下，第一期的企业学员总算到位，此后两期结业的学员企业中，超七成开展了跨境电商交易，成果最好的一家雨鞋制造企业，如今已有20万美元的月销售额。　　除了前期培训，围绕外贸企业的精准服务，还体现在更多领域。　　2020年4月，“金贸信融”融资业务在金义新区先行先试，通过强化“政、银、企、保”四方联动，帮助外贸企业解决融资问题。截至目前，已累计发放小微企业贷款1300万元。　　创新“义新欧”中欧班列运营和运行机制，开展过境班列、进口班列、“国际班列+”等特色业务。2020年，金华平台返程开行占比41.4%，基本实现双向均衡运输。　　拓展海铁联运业务，将港口船务等服务功能向内陆地区延伸，为外贸企业降低物流成本、提高出货效率。今年一季度，义乌海铁联运班列开行112列，业务量同比增长118%。　　一系列精准高效服务进一步激发了市场活力。数据显示，今年1—2月，金华实现进出口总额790.2亿元，同比增长53.2%，分别高于全国、浙江21.0、10.8个百分点。其中，出口735.1亿元，同比增长49.9%，对浙江出口增长的贡献率为17.3%。　　从帮着卖到助成长，长远发展底气足　　这段时间，金华市贸促会展览部部长张胜，一边帮着处理2021浙江金华出口网上交易会中一个专场的后续对接工作，一边做着下一场网上交易会的筹备工作。这场春节后的当地首场出口网上交易会，达成采购意向金额总计1135万美元。　　去年以来，受疫情影响，金华迅速调整外贸展会方式，变线下展会为云上展会，启动金华制造“云参展”“云对接”活动。2020年，金华陆续推出10场出口网上交易会，分别匹配当地重点出口产品和区域。　　在“帮着卖”的同时，“帮着运”也是眼下金华外贸的一项重点工作。　　“从去年第四季度开始，海运价格和集装箱提柜费用就一直在涨。而且即使愿意付高价，也很难协调到运力。”方恬说。尽管永康市商务部门为了缓解运力难问题推出了诸多举措——建立黑白名单制度、引进跨境物流企业、建立港口合作机制等，由于外贸订单火爆依然出现“一柜难求”现象。最近启动的“集装箱一件事改革”则让方恬和不少外贸同行又多了一些底气。　　“现征集企业4月以后的货运需求，有以下3个表格：订单、储运、订舱计划……”在这个名为“永康市商务运行监测企业群”的微信群里，永康市商务局的工作人员不仅详细列出了填报的细节要求，还留下了联系电话方便解答。　　无论是“帮着卖”还是“帮着运”，都只是金华整合全域力量推动外贸高质量发展的缩影。从出台《金华市推进贸易高质量发展行动计划（2021—2023年）》、实行进口3年倍增行动，到深化新型贸易业态发展行动、实施精准服务企业行动，一系列从政府层面出台的稳外贸举措，不仅助力了当前的发展，也播下了未来的种子。　　去年9月，浙江自由贸易试验区扩展区域方案正式发布，其中将地处金华的金义片区定义为世界“小商品之都”，建设国际小商品自由贸易中心、数字贸易创新中心、内陆国际物流枢纽港、制造创新示范地和“一带一路”开放合作重要平台。揭牌半年有余，金义片区正迎来新的发展高潮。如今的金华，人流、物流、资金流、信息流加速涌动，带着对未来的憧憬，脚步不停，加速向前。　　“站在现有的发展起点上，借助日渐完善的系统专业的发展合力，金华将在加快构建新发展格局的过程中，闯出外贸高质量发展的新天地。”金华市副市长邵国强说。"
"2021年04月22日","10","经济","食品安全形势保持稳中向好","http://paper.people.com.cn/rmrb/html/2021-04/22/nw.D110000renmrb_20210422_2-10.htm","国家市场监督管理总局4月21日举办二季度例行新闻发布会，发布2020年食品安全监督抽检情况，全年市场监管部门完成食品安全监督抽检638万余批次，总体不合格率为2.31%，与2019年基本持平。　　市场监管总局食品抽检司副司长梁钢说：“我国食品安全形势总体保持稳中向好的态势。消费者购物主要渠道之一的网购食品抽检不合格率为2.30%，与总体不合格率持平。消费者日常消费量大的米面油、肉蛋奶等大宗食品和婴幼儿配方食品、特殊膳食食品、保健食品等30类食品抽检不合格率低于总体不合格率。”　　同时，抽检数据显示，一些食品安全问题仍需持续治理。一是微生物污染、农兽药残留超标等问题仍较突出。二是个别食品类别的抽检不合格率较高。2020年，市场监管部门加大对小餐饮、小吃店等抽检力度，餐饮食品抽检不合格率为5.99%，主要不合格项目为微生物污染，呈现餐饮单位规模越小、抽检不合格率越高的趋势；蔬菜制品抽检不合格率为3.45%，主要是超范围超限量使用食品添加剂问题。　　梁钢介绍，针对监督抽检发现的不合格产品，各地市场监管部门均已及时采取了封存、下架、召回等措施控制风险。2020年，下架、封存、召回不合格食品3596吨，罚没金额10.93亿元。　　在严防疫情期间食品安全风险方面，市场监管总局新闻发言人、新闻宣传司司长于军介绍，市场监管总局加强进口冷链食品安全监管，督促食品生产经营者认真落实进口冷链食品“三专、三证、四不”要求；及时开展涉疫食品排查管控，全年各地共排查涉疫食品13896吨，涉疫食品基本得到有效管控。应时所需快速建设冷链食品追溯系统，已经初步建成上线全国进口冷链食品追溯管理平台，推动31个省份实现与全国平台的数据对接。　　在打击农村假冒伪劣食品方面，市场监管总局会同公安部、农业农村部、商务部、中华全国供销合作总社、知识产权局启动为期3年的农村假冒伪劣食品专项整治，从2020年10月底开始开展农村假冒伪劣食品专项执法行动。截至今年3月15日，各地查处农村假冒伪劣食品案件47664件，罚没款3.5亿元，查扣违法产品2016吨，移送公安机关808件。市场监管总局食品经营司市场稽查专员陈谞说：“今年，市场监管总局将重点推进农村食品生产经营行为规范行动，督促农村食品生产经营者全面落实食品安全主体责任，合法合规开展生产经营活动。”"
"2021年04月22日","10","经济","一季度末银行业总资产增长9.2%","http://paper.people.com.cn/rmrb/html/2021-04/22/nw.D110000renmrb_20210422_3-10.htm","本报北京4月21日电  （记者赵展慧）银保监会日前发布一季度银行业保险业主要监管指标数据。一季度末，银行业总资产329.6万亿元，同比增长9.2%。总负债302万亿元，同比增长9.2%。保险业总资产24.3万亿元，同比增长11.7%。银行业和保险业资产和业务保持稳健增长，既有效满足实体经济恢复发展需要，也避免过快增长加大金融杠杆。　　同时，服务实体经济质效进一步提高。一季度，人民币贷款增加7.7万亿元，同比多增5741亿元，继续保持适度增长，为经济恢复和保市场主体提供稳定资金支持。信贷资金更多流向科技创新、绿色发展和小微企业、个体工商户、新型农业经营主体。一季度，银行保险机构新增债券投资约1.7万亿元，为政府和企业债券融资提供有力支持。一季度末，保险业提供保险保障金额2862万亿元，同比增长28.7%。一季度，保险累计赔付支出3951亿元，同比增长30.4%。　　主要经营和风险指标处于合理区间。一季度末，不良贷款余额3.6万亿元，较年初增加1183亿元，不良贷款率1.89%，较年初下降0.02个百分点，逾期90天以上贷款与不良贷款比例81.5%，继续保持在较低水平。银行保险机构流动性总体保持平稳，商业银行流动性覆盖率141.8%，保险公司经营活动现金流稳定增长。"
"2021年04月22日","10","经济","跨越珠江口","http://paper.people.com.cn/rmrb/html/2021-04/22/nw.D110000renmrb_20210422_4-10.htm","近日，广东省深中通道水上上部结构进入全面施工阶段，桥梁主桥桩基、承台已全部完成。　　深中通道是国家高速公路网G2518（深圳至广西岑溪）跨珠江口关键性工程，路线全长约24公里。项目从深圳向西跨越珠江口，在中山市马鞍岛登陆。深中通道的建设对加快粤东、粤西地区振兴发展和推动粤港澳大湾区城市群融合发展具有重要意义。　　本报记者  张武军摄"
"2021年04月22日","10","经济","我国建成加氢站128座","http://paper.people.com.cn/rmrb/html/2021-04/22/nw.D110000renmrb_20210422_5-10.htm","本报北京4月21日电  （记者丁怡婷）记者21日从中国氢能联盟举办的“十四五”氢能产业发展论坛上获悉：截至2020年底，全球加氢站约为544座，我国建成加氢站128座，氢燃料电池汽车累计保有量达7000多辆。　　2019年，我国氢气产量中，煤制氢占63.54%、天然气制氢占13.76%、工业副产氢占21.18%、电解水制氢仅占约1.52%。产能主要集中在西北、华北和华东地区。不少专家认为，未来在应对气候变化的大背景下，可再生能源制氢是主要的发力方向。　　未来，风电、光伏等可再生能源电解水制氢的成本是否具有竞争性？中国氢能联盟专家委员会主任余卓平分析，如果到2025年我国风电、光伏的新增装机发电成本降低到0.3元/千瓦时，可再生能源电解水制氢成本将降到约25元/千克，能够与天然气制氢进行竞争。等2030年可再生能源发电成本降低到0.2元/千瓦时后，电解水制氢成本将低至15元/千克，可以与现在化石能源加上碳捕集技术制氢的价格进行竞争。　　中国科学院院士徐冠华建议，氢能产业要建立起资源共享、优势互补、利益共享、协同配合的合作机制，防止一哄而上、一松而散；与此同时，注重基础研究和前沿技术研究在氢能产业发展中的重要性，关键技术的研发需要脚踏实地，在应用中不断提升。"
